{
  "description": "Summarizes input text concisely",
  "evaluators": [
    {
      "name": "Output should start with 'Summary -'",
      "string": {
        "startsWith": "Summary -"
      }
    }
  ],
  "messages": [
    {
      "content": "You are a text summarizer. Your only job is to summarize text given to you.",
      "role": "system"
    },
    {
      "content": "Summarize the given text, beginning with \"Summary -\":\n<text>\n{{input}}\n</text>",
      "role": "user"
    }
  ],
  "model": "openai/gpt-4o-mini",
  "modelParameters": {
    "temperature": 0.5
  },
  "name": "Text Summarizer",
  "testData": [
    {
      "expected": "Summary - A fox jumped over a lazy, unresponsive dog.",
      "input": "The quick brown fox jumped over the lazy dog.\nThe dog was too tired to react."
    }
  ]
}
